{
  "schema_version": "run_spec_v1",
  "blueprint_ref": { "blueprint_id": "bp_demo_001", "blueprint_hash": "sha256:deadbeef" },
  "policy_bundle_id": "policy_bundle_v1",
  "data_snapshot_id": "data_snapshot_demo_001",
  "segments": {
    "train": { "start": "2020-01-01", "end": "2022-12-31", "as_of": "2023-01-01T00:00:00Z" },
    "test": { "start": "2023-01-01", "end": "2023-12-31", "as_of": "2024-01-01T00:00:00Z" },
    "holdout": { "start": "2024-01-01", "end": "2024-12-31", "as_of": "2025-01-01T00:00:00Z" }
  },
  "adapter": { "adapter_id": "vectorbt_signal_v1" },
  "output_spec": {
    "write_dossier": true,
    "artifacts": {
      "dossier_manifest_json": "dossier_manifest.json",
      "gate_results_json": "gate_results.json",
      "metrics_json": "metrics.json",
      "curve_csv": "curve.csv",
      "trades_csv": "trades.csv"
    }
  }
}

